{
  "$schema": "https://json-schema.org/draft/2020-12/schema",
  "$id": "https://example.org/imaging-passport.schema-1.1.1.json",
  "title": "Imaging Dataset Reliability Passport",
  "type": "object",
  "required": [
    "schema_version",
    "passport_id",
    "created_at",
    "dataset_identity",
    "execution_identity",
    "modules",
    "claim_gates"
  ],
  "properties": {
    "schema_version": {
      "type": "string"
    },
    "passport_id": {
      "type": "string"
    },
    "created_at": {
      "type": "string"
    },
    "dataset_identity": {
      "type": "object",
      "required": [
        "name",
        "root_manifest_hash",
        "file_count"
      ],
      "properties": {
        "name": {
          "type": "string"
        },
        "version": {
          "type": [
            "string",
            "null"
          ]
        },
        "access_date": {
          "type": "string"
        },
        "root_manifest_hash": {
          "type": "string"
        },
        "file_count": {
          "type": "integer"
        },
        "license": {
          "type": [
            "string",
            "null"
          ]
        }
      }
    },
    "execution_identity": {
      "type": "object",
      "required": [
        "software_version",
        "configuration_hash",
        "environment_fingerprint"
      ],
      "properties": {
        "software_version": {
          "type": "string"
        },
        "configuration_hash": {
          "type": "string"
        },
        "environment_fingerprint": {
          "type": "string"
        }
      }
    },
    "modules": {
      "type": "object",
      "required": [
        "image_identity",
        "label_integrity",
        "provenance",
        "partition_integrity",
        "shortcut_controls",
        "reliability_evidence"
      ],
      "additionalProperties": {
        "type": [
          "object",
          "array",
          "string",
          "number",
          "boolean",
          "null"
        ]
      }
    },
    "claim_gates": {
      "type": "array",
      "items": {
        "type": "object",
        "required": [
          "claim_id",
          "claim",
          "state",
          "rule_id",
          "rationale",
          "depends_on",
          "effective_state",
          "threshold_provenance"
        ],
        "properties": {
          "claim_id": {
            "type": "string"
          },
          "claim": {
            "type": "string"
          },
          "state": {
            "enum": [
              "supported_in_evaluated_setting",
              "conditional",
              "blocked",
              "not_evaluated"
            ]
          },
          "rule_id": {
            "type": "string"
          },
          "evidence": {
            "type": [
              "object",
              "array",
              "string",
              "number",
              "null"
            ]
          },
          "rationale": {
            "type": "string"
          },
          "depends_on": {
            "type": "array",
            "items": {
              "type": "string"
            }
          },
          "effective_state": {
            "enum": [
              "supported_in_evaluated_setting",
              "conditional",
              "blocked",
              "not_evaluated"
            ]
          },
          "threshold_provenance": {
            "type": [
              "object",
              "null"
            ],
            "required": [
              "config_key",
              "value",
              "rationale",
              "override"
            ],
            "properties": {
              "config_key": {
                "type": [
                  "string",
                  "null"
                ]
              },
              "value": {
                "type": [
                  "number",
                  "null"
                ]
              },
              "rationale": {
                "type": "string"
              },
              "override": {
                "type": [
                  "object",
                  "null"
                ],
                "required": [
                  "value",
                  "by",
                  "rationale",
                  "timestamp"
                ],
                "properties": {
                  "value": {
                    "type": "number"
                  },
                  "by": {
                    "type": "string"
                  },
                  "rationale": {
                    "type": "string"
                  },
                  "timestamp": {
                    "type": "string"
                  }
                }
              }
            }
          },
          "model_scope": {
            "type": [
              "object",
              "null"
            ],
            "description": "The model a model-dependent gate was computed from. Null for gates that do not depend on a fitted model.",
            "required": [
              "model",
              "determined_by",
              "prediction_digest"
            ],
            "properties": {
              "model": {
                "type": "string"
              },
              "determined_by": {
                "type": "object"
              },
              "prediction_digest": {
                "type": [
                  "string",
                  "null"
                ],
                "description": "Canonical digest of the model's test-set probability matrix. Emitted from software version 0.3; null for 0.2 runs."
              }
            }
          }
        }
      }
    }
  }
}